{"year": 2025, "lastUpdated": "2026-06-28", "summary": {"club": {"white": 109, "black": 49}, "state": {"white": 12, "black": 4}, "totals": {"white": 121, "black": 53, "all": 174}}, "players": [{"id": "kunal-raut", "name": "Kunal Raut", "club": null, "displayOrder": 1, "slams": {"club": {"white": 22, "black": 7}, "state": {"white": 0, "black": 0}}, "totals": {"white": 22, "black": 7, "all": 29}}, {"id": "babu-bhai", "name": "Babu Bhai", "club": null, "displayOrder": 2, "slams": {"club": {"white": 6, "black": 9}, "state": {"white": 0, "black": 0}}, "totals": {"white": 6, "black": 9, "all": 15}}, {"id": "harish-bhai", "name": "Harish Bhai", "club": null, "displayOrder": 3, "slams": {"club": {"white": 8, "black": 4}, "state": {"white": 0, "black": 0}}, "totals": {"white": 8, "black": 4, "all": 12}}, {"id": "sachin-chalwadi", "name": "Sachin Chalwadi", "club": null, "displayOrder": 4, "slams": {"club": {"white": 5, "black": 7}, "state": {"white": 0, "black": 0}}, "totals": {"white": 5, "black": 7, "all": 12}}, {"id": "anilkumar-singh", "name": "Anilkumar Singh", "club": null, "displayOrder": 5, "slams": {"club": {"white": 9, "black": 0}, "state": {"white": 0, "black": 0}}, "totals": {"white": 9, "black": 0, "all": 9}}, {"id": "mandar-barde", "name": "Mandar Barde", "club": null, "displayOrder": 6, "slams": {"club": {"white": 5, "black": 2}, "state": {"white": 0, "black": 0}}, "totals": {"white": 5, "black": 2, "all": 7}}, {"id": "javed-khan", "name": "Javed Khan", "club": null, "displayOrder": 7, "slams": {"club": {"white": 4, "black": 3}, "state": {"white": 0, "black": 0}}, "totals": {"white": 4, "black": 3, "all": 7}}, {"id": "sudhir-shinde", "name": "Sudhir Shinde", "club": null, "displayOrder": 8, "slams": {"club": {"white": 6, "black": 0}, "state": {"white": 0, "black": 0}}, "totals": {"white": 6, "black": 0, "all": 6}}, {"id": "navnath-kamble", "name": "Navnath Kamble", "club": null, "displayOrder": 9, "slams": {"club": {"white": 5, "black": 1}, "state": {"white": 0, "black": 0}}, "totals": {"white": 5, "black": 1, "all": 6}}, {"id": "pankaj-pawar", "name": "Pankaj Pawar", "club": null, "displayOrder": 10, "slams": {"club": {"white": 0, "black": 0}, "state": {"white": 5, "black": 1}}, "totals": {"white": 5, "black": 1, "all": 6}}, {"id": "swaraj", "name": "Swaraj", "club": null, "displayOrder": 11, "slams": {"club": {"white": 2, "black": 4}, "state": {"white": 0, "black": 0}}, "totals": {"white": 2, "black": 4, "all": 6}}, {"id": "premkumar-mishra", "name": "Premkumar Mishra", "club": null, "displayOrder": 12, "slams": {"club": {"white": 1, "black": 1}, "state": {"white": 2, "black": 0}}, "totals": {"white": 3, "black": 1, "all": 4}}, {"id": "kiran-soman", "name": "Kiran Soman", "club": null, "displayOrder": 13, "slams": {"club": {"white": 3, "black": 0}, "state": {"white": 0, "black": 0}}, "totals": {"white": 3, "black": 0, "all": 3}}, {"id": "mujeeb-sayyed", "name": "Mujeeb Sayyed", "club": null, "displayOrder": 14, "slams": {"club": {"white": 2, "black": 0}, "state": {"white": 1, "black": 0}}, "totals": {"white": 3, "black": 0, "all": 3}}, {"id": "shehbazh", "name": "Shehbazh", "club": null, "displayOrder": 15, "slams": {"club": {"white": 3, "black": 0}, "state": {"white": 0, "black": 0}}, "totals": {"white": 3, "black": 0, "all": 3}}, {"id": "taufiq-shaikh", "name": "Taufiq Shaikh", "club": null, "displayOrder": 16, "slams": {"club": {"white": 3, "black": 0}, "state": {"white": 0, "black": 0}}, "totals": {"white": 3, "black": 0, "all": 3}}, {"id": "akshay-dey", "name": "Akshay Dey", "club": null, "displayOrder": 17, "slams": {"club": {"white": 2, "black": 0}, "state": {"white": 0, "black": 0}}, "totals": {"white": 2, "black": 0, "all": 2}}, {"id": "anil-taishetty", "name": "Anil Taishetty", "club": "Sai Carrom", "displayOrder": 18, "slams": {"club": {"white": 2, "black": 0}, "state": {"white": 0, "black": 0}}, "totals": {"white": 2, "black": 0, "all": 2}}, {"id": "saurabh-gulati", "name": "Saurabh Gulati", "club": null, "displayOrder": 19, "slams": {"club": {"white": 2, "black": 0}, "state": {"white": 0, "black": 0}}, "totals": {"white": 2, "black": 0, "all": 2}}, {"id": "suhas-wakankar", "name": "Suhas Wakankar", "club": null, "displayOrder": 20, "slams": {"club": {"white": 2, "black": 0}, "state": {"white": 0, "black": 0}}, "totals": {"white": 2, "black": 0, "all": 2}}, {"id": "amol", "name": "Amol", "club": null, "displayOrder": 21, "slams": {"club": {"white": 1, "black": 1}, "state": {"white": 0, "black": 0}}, "totals": {"white": 1, "black": 1, "all": 2}}, {"id": "bhavesh-rane", "name": "Bhavesh Rane", "club": null, "displayOrder": 22, "slams": {"club": {"white": 1, "black": 1}, "state": {"white": 0, "black": 0}}, "totals": {"white": 1, "black": 1, "all": 2}}, {"id": "manish-patil", "name": "Manish Patil", "club": null, "displayOrder": 23, "slams": {"club": {"white": 1, "black": 1}, "state": {"white": 0, "black": 0}}, "totals": {"white": 1, "black": 1, "all": 2}}, {"id": "reylond", "name": "Reylond", "club": null, "displayOrder": 24, "slams": {"club": {"white": 1, "black": 1}, "state": {"white": 0, "black": 0}}, "totals": {"white": 1, "black": 1, "all": 2}}, {"id": "satya-arekar", "name": "Satya Arekar", "club": null, "displayOrder": 25, "slams": {"club": {"white": 1, "black": 1}, "state": {"white": 0, "black": 0}}, "totals": {"white": 1, "black": 1, "all": 2}}, {"id": "zaid-ahmed-farooquee", "name": "Zaid Ahmed Farooquee", "club": null, "displayOrder": 26, "slams": {"club": {"white": 0, "black": 0}, "state": {"white": 1, "black": 1}}, "totals": {"white": 1, "black": 1, "all": 2}}, {"id": "arif-bhai", "name": "Arif Bhai", "club": null, "displayOrder": 27, "slams": {"club": {"white": 1, "black": 0}, "state": {"white": 0, "black": 0}}, "totals": {"white": 1, "black": 0, "all": 1}}, {"id": "bhavesh-parmar", "name": "Bhavesh Parmar", "club": null, "displayOrder": 28, "slams": {"club": {"white": 0, "black": 0}, "state": {"white": 1, "black": 0}}, "totals": {"white": 1, "black": 0, "all": 1}}, {"id": "imran-k", "name": "Imran K", "club": null, "displayOrder": 29, "slams": {"club": {"white": 1, "black": 0}, "state": {"white": 0, "black": 0}}, "totals": {"white": 1, "black": 0, "all": 1}}, {"id": "madhura-devle", "name": "Madhura Devle", "club": null, "displayOrder": 30, "slams": {"club": {"white": 1, "black": 0}, "state": {"white": 0, "black": 0}}, "totals": {"white": 1, "black": 0, "all": 1}}, {"id": "mukesh-mandodare", "name": "Mukesh Mandodare", "club": null, "displayOrder": 31, "slams": {"club": {"white": 1, "black": 0}, "state": {"white": 0, "black": 0}}, "totals": {"white": 1, "black": 0, "all": 1}}, {"id": "naushad-shaikh", "name": "Naushad Shaikh", "club": null, "displayOrder": 32, "slams": {"club": {"white": 0, "black": 0}, "state": {"white": 1, "black": 0}}, "totals": {"white": 1, "black": 0, "all": 1}}, {"id": "omkar", "name": "Omkar", "club": null, "displayOrder": 33, "slams": {"club": {"white": 1, "black": 0}, "state": {"white": 0, "black": 0}}, "totals": {"white": 1, "black": 0, "all": 1}}, {"id": "parag-desai", "name": "Parag Desai", "club": null, "displayOrder": 34, "slams": {"club": {"white": 1, "black": 0}, "state": {"white": 0, "black": 0}}, "totals": {"white": 1, "black": 0, "all": 1}}, {"id": "pravin-raut", "name": "Pravin Raut", "club": null, "displayOrder": 35, "slams": {"club": {"white": 1, "black": 0}, "state": {"white": 0, "black": 0}}, "totals": {"white": 1, "black": 0, "all": 1}}, {"id": "samir-ansari", "name": "Samir Ansari", "club": null, "displayOrder": 36, "slams": {"club": {"white": 0, "black": 0}, "state": {"white": 1, "black": 0}}, "totals": {"white": 1, "black": 0, "all": 1}}, {"id": "shanu-quereshi", "name": "Shanu Quereshi", "club": null, "displayOrder": 37, "slams": {"club": {"white": 1, "black": 0}, "state": {"white": 0, "black": 0}}, "totals": {"white": 1, "black": 0, "all": 1}}, {"id": "tanmay-mane", "name": "Tanmay Mane", "club": null, "displayOrder": 38, "slams": {"club": {"white": 1, "black": 0}, "state": {"white": 0, "black": 0}}, "totals": {"white": 1, "black": 0, "all": 1}}, {"id": "vaibhav-jadhav", "name": "Vaibhav Jadhav", "club": null, "displayOrder": 39, "slams": {"club": {"white": 1, "black": 0}, "state": {"white": 0, "black": 0}}, "totals": {"white": 1, "black": 0, "all": 1}}, {"id": "vaibhav-koregaonkar", "name": "Vaibhav Koregaonkar", "club": null, "displayOrder": 40, "slams": {"club": {"white": 1, "black": 0}, "state": {"white": 0, "black": 0}}, "totals": {"white": 1, "black": 0, "all": 1}}, {"id": "vijay", "name": "Vijay", "club": null, "displayOrder": 41, "slams": {"club": {"white": 1, "black": 0}, "state": {"white": 0, "black": 0}}, "totals": {"white": 1, "black": 0, "all": 1}}, {"id": "arif-shaikh", "name": "Arif Shaikh", "club": null, "displayOrder": 42, "slams": {"club": {"white": 0, "black": 0}, "state": {"white": 0, "black": 1}}, "totals": {"white": 0, "black": 1, "all": 1}}, {"id": "darshan", "name": "Darshan", "club": null, "displayOrder": 43, "slams": {"club": {"white": 0, "black": 1}, "state": {"white": 0, "black": 0}}, "totals": {"white": 0, "black": 1, "all": 1}}, {"id": "dharam", "name": "Dharam", "club": null, "displayOrder": 44, "slams": {"club": {"white": 0, "black": 1}, "state": {"white": 0, "black": 0}}, "totals": {"white": 0, "black": 1, "all": 1}}, {"id": "imran-memon", "name": "Imran Memon", "club": null, "displayOrder": 45, "slams": {"club": {"white": 0, "black": 1}, "state": {"white": 0, "black": 0}}, "totals": {"white": 0, "black": 1, "all": 1}}, {"id": "imran-quereshi", "name": "Imran Quereshi", "club": null, "displayOrder": 46, "slams": {"club": {"white": 0, "black": 1}, "state": {"white": 0, "black": 0}}, "totals": {"white": 0, "black": 1, "all": 1}}, {"id": "mahesh-shetye", "name": "Mahesh Shetye", "club": null, "displayOrder": 47, "slams": {"club": {"white": 0, "black": 0}, "state": {"white": 0, "black": 1}}, "totals": {"white": 0, "black": 1, "all": 1}}, {"id": "pradeep-satam", "name": "Pradeep Satam", "club": null, "di